{
  "apiVersion": "capsule.dev/v0",
  "kind": "JobProposal",
  "source": {
    "entrypoint": "src/main.ts",
    "files": {
      "z.ts": "export const z = \"🚀\";\n",
      "src/main.ts": "import { a } from \"../A.ts\";\nconsole.log(a);\n",
      "A.ts": "export const a = 1;\r\n"
    }
  },
  "runtimeProfile": "fixture-active@1",
  "input": {
    "slot": "primary-data",
    "kind": "inline-json",
    "value": {
      "z": [
        3,
        0,
        -2,
        true,
        null
      ],
      "a": "quote:\" slash:/ backslash:\\ control:\u0000\u001f rocket:🚀",
      "A": {
        "b": false,
        "a": "é"
      }
    }
  },
  "requestedLimits": {
    "wallTimeMs": 5000
  },
  "outputs": [
    {
      "slot": "transformed-json",
      "kind": "inline-json",
      "maxBytes": 65536
    }
  ],
  "labels": {
    "label-0": "v",
    "label-1": "v",
    "label-2": "v",
    "label-3": "v",
    "label-4": "v",
    "label-5": "v",
    "label-6": "v",
    "label-7": "v",
    "label-8": "v"
  }
}
