{
  "apiVersion": "capsule.dev/v0",
  "kind": "JobProposal",
  "source": {
    "entrypoint": "f00.ts",
    "files": {
      "f00.ts": "",
      "f01.ts": "",
      "f02.ts": "",
      "f03.ts": "",
      "f04.ts": "",
      "f05.ts": "",
      "f06.ts": "",
      "f07.ts": "",
      "f08.ts": "",
      "f09.ts": "",
      "f10.ts": "",
      "f11.ts": "",
      "f12.ts": "",
      "f13.ts": "",
      "f14.ts": "",
      "f15.ts": "",
      "f16.ts": "",
      "f17.ts": "",
      "f18.ts": "",
      "f19.ts": "",
      "f20.ts": "",
      "f21.ts": "",
      "f22.ts": "",
      "f23.ts": "",
      "f24.ts": "",
      "f25.ts": "",
      "f26.ts": "",
      "f27.ts": "",
      "f28.ts": "",
      "f29.ts": "",
      "f30.ts": "",
      "f31.ts": ""
    }
  },
  "runtimeProfile": "fixture-active@1",
  "input": {
    "slot": "primary-data",
    "kind": "inline-json",
    "value": {
      "z": [
        3,
        0,
        -2,
        true,
        null
      ],
      "a": "quote:\" slash:/ backslash:\\ control:\u0000\u001f rocket:🚀",
      "A": {
        "b": false,
        "a": "é"
      }
    }
  },
  "requestedLimits": {
    "wallTimeMs": 5000
  },
  "outputs": [
    {
      "slot": "transformed-json",
      "kind": "inline-json",
      "maxBytes": 65536
    }
  ],
  "labels": {
    "example": "known-answer"
  }
}
